17.01.2019 09:11:20 Successful Transmission

No.     Date-Time                       Source          Destination     Prot    Len    Info 
=======================================================================================================================================================
352	2019-01-17 09:11:20,844053	192.168.123.168	47.91.242.120	TCP	102	49153 → 10013 [PSH, ACK] Seq=1031 Ack=67076651 Win=2854 Len=48
    Payload  680030 681006 90010597 0000000002000010022300027983220247200e84001c31661b3337e431fc0000000000003316

353	2019-01-17 09:11:21,184859	47.91.242.120	192.168.123.168	TCP	102	10013 → 49153 [PSH, ACK] Seq=67076651 Ack=1079 Win=64310 Len=48
    Payload  680030 681007 90010597 0000000002000010022300027983220247200e84001c31661b3337e431fc0000000000003316

354	2019-01-17 09:11:21,185431	192.168.123.168	47.91.242.120	TCP	60	49153 → 10013 [ACK] Seq=1079 Ack=67076699 Win=2806 Len=0

355	2019-01-17 09:11:21,185870	192.168.123.168	47.91.242.120	TCP	1036	49153 → 10013 [PSH, ACK] Seq=1079 Ack=67076699 Win=2806 Len=982
    Payload  6803d6 681004 90010597 00000000000000000000 11127983 220244c015ec001c31661b59384932040000000000000000
             000000000000000000000000000000000000000000000000000000000000000000000000000000000000000000000000
             000000000000000000000000000000000000000000000000000000000000000000000000000000000000000000000000
             000000000000000000000000000000000000000000000000000000000000000000000000000000000000000000000000
             000000000000000000000000000000000000000000000000000000000000000000000000000000000000000000000000
             000000000000000000000000000000000000000000000000000000000000000000000000000000000000000000000000
             000000000000000000000000000000000000000000000000000000000000000000000000000000000000000000000000
             000000000000000000000000000000000000000000000000000000000000000000000000000000000000000000000000
             000000000000000000000000000000000000000000000000000000000000000000000000000000000000000000000000
             000000000000000000000000000000000000000000000000000000000000000000000000000000000000000000000000
             000000000000000000000000000000000000000000000000000000000000000000000000000000000000000000000000
             000000000000000000000000000000000000000000000000000000000000000000000000000000000000000000000000
             000000000000000000000000000000000000000000000000000000000000000000000000000000000000000000000000
             000000000000000000000000000000000000000000000000000000000000000000000000000000000000000000000000
             000000000000000000000000000000000000000000000000000000000000000000000000000000000000000000000000
             000000000000000000000000000000000000000000000000000000000000000000000000000000000000000000000000
             000000000000000000000000000000000000000000000000000000000000000000000000000000000000000000000000
             000000000000000000000000000000000000000000000000000000000000000000000000000000000000000000000000
             000000000000000000000000000000000000000000000000000000000000000000000000000000000000000000000000
             000000000000000000000000000000000000000000000000000000000000000000000000000000000000000000000000
             00000000000000000000000000000000000000006516

356	2019-01-17 09:11:21,528433	47.91.242.120	192.168.123.168	TCP	72	10013 → 49153 [PSH, ACK] Seq=67076699 Ack=2061 Win=65340 Len=18
    Payload  680012 681015 90010597 0000000000008916

357	2019-01-17 09:11:21,528969	192.168.123.168	47.91.242.120	TCP	60	49153 → 10013 [ACK] Seq=2061 Ack=67076717 Win=2788 Len=0


Test Client
===========
576	2019-01-20 13:28:50,996839087	192.168.123.214	192.168.123.14	TCP	74	56646 → 10013 [SYN] Seq=0 Win=29200 Len=0 MSS=1460 SACK_PERM=1 TSval=1505790293 TSecr=0 WS=128

577	2019-01-20 13:28:50,997080038	192.168.123.14	192.168.123.214	TCP	74	10013 → 56646 [SYN, ACK] Seq=0 Ack=1 Win=28960 Len=0 MSS=1460 SACK_PERM=1 TSval=1050230514 TSecr=1505790293 WS=128

578	2019-01-20 13:28:50,997520093	192.168.123.214	192.168.123.14	TCP	66	56646 → 10013 [ACK] Seq=1 Ack=1 Win=29312 Len=0 TSval=1505790294 TSecr=1050230514

579	2019-01-20 13:28:50,997714037	192.168.123.214	192.168.123.14	TCP	1048	56646 → 10013 [PSH, ACK] Seq=1 Ack=1 Win=29312 Len=982 TSval=1505790294 TSecr=1050230514

580	2019-01-20 13:28:50,997739463	192.168.123.14	192.168.123.214	TCP	66	10013 → 56646 [ACK] Seq=1 Ack=983 Win=30976 Len=0 TSval=1050230515 TSecr=1505790294

581	2019-01-20 13:28:50,997744506	192.168.123.214	192.168.123.14	TCP	66	56646 → 10013 [FIN, ACK] Seq=983 Ack=1 Win=29312 Len=0 TSval=1505790294 TSecr=1050230514

582	2019-01-20 13:28:50,998676588	192.168.123.14	47.91.242.120	TCP	74	36364 → 10013 [SYN] Seq=0 Win=29200 Len=0 MSS=1460 SACK_PERM=1 TSval=3455218813 TSecr=0 WS=128

583	2019-01-20 13:28:51,039645774	192.168.123.14	192.168.123.214	TCP	66	10013 → 56646 [ACK] Seq=1 Ack=984 Win=30976 Len=0 TSval=1050230557 TSecr=1505790294

584	2019-01-20 13:28:51,342071176	47.91.242.120	192.168.123.14	TCP	74	10013 → 36364 [SYN, ACK] Seq=0 Ack=1 Win=8192 Len=0 MSS=1452 WS=256 SACK_PERM=1 TSval=45079721 TSecr=3455218813

585	2019-01-20 13:28:51,342125353	192.168.123.14	47.91.242.120	TCP	66	36364 → 10013 [ACK] Seq=1 Ack=1 Win=29312 Len=0 TSval=3455219156 TSecr=45079721

704	2019-01-20 13:28:53,710761042	192.168.123.14	47.91.242.120	TCP	66	36364 → 10013 [FIN, ACK] Seq=983 Ack=1 Win=29312 Len=0 TSval=3455221525 TSecr=45079721

708	2019-01-20 13:28:54,055138100	47.91.242.120	192.168.123.14	TCP	66	10013 → 36364 [ACK] Seq=1 Ack=984 Win=132352 Len=0 TSval=45079992 TSecr=3455221524

709	2019-01-20 13:28:54,055170733	47.91.242.120	192.168.123.14	TCP	66	10013 → 36364 [FIN, ACK] Seq=1 Ack=984 Win=132352 Len=0 TSval=45079992 TSecr=3455221524

710	2019-01-20 13:28:54,055187022	192.168.123.14	47.91.242.120	TCP	66	36364 → 10013 [ACK] Seq=984 Ack=2 Win=29312 Len=0 TSval=3455221869 TSecr=45079992
